"";"article_number";"article_title";"article_text";"Obs.";"Issue.1";"Domain.1";"Project.1";"Issue.2";"Domain.2";"Project.2";"Issue.3";"Domain.3";"Project.3"
"76";"Art. 56";"  Art. 56 Ausbildung von Fachpersonal und Aufklärung der Bevölkerung";"Die Finanzhilfen für die Ausbildung von Fachpersonal (Art. 64 Abs. 2 GSchG) betragen: a.bis zu 25 Prozent der Kosten;b.bis zu 40 Prozent der Kosten bei Vorhaben, die im Verhältnis zur Anzahl der voraussichtlich Teilnehmenden besonders aufwendig sind. 2 Finanzhilfen für die Aufklärung der Bevölkerung (Art. 64 Abs. 2 GSchG) können an Vorhaben gewährt werden, wenn: a.sie von gesamtschweizerischer Bedeutung sind; undb.die Aufklärungsunterlagen für die Verbreitung in der ganzen Schweiz zur Verfügung gestellt werden. 3 Die Finanzhilfen für die Aufklärung der Bevölkerung betragen: a.bis zu 40 Prozent der Kosten für die Erstellung von Unterlagen;b.bis zu 20 Prozent der Kosten für die Durchführung von Informationskampagnen. 4 Das BAFU gewährt Finanzhilfen für die Ausbildung von Fachpersonal und die Aufklärung der Bevölkerung einzeln.";"";NA;NA;"";NA;NA;"";NA;NA;""
"77";"Art. 57";"  Art. 57 Risikogarantie";"1 Eine Risikogarantie für erfolgversprechende neuartige Anlagen und Einrichtungen (Art. 64a GSchG), mit denen eine öffentliche Aufgabe erfüllt wird, kann gewährt werden, soweit Firmengarantien nicht erhältlich sind. 2 Die Risikogarantie gilt für die Kosten, die für die Behebung von Mängeln oder nötigenfalls für die Neuerstellung der Anlagen und Einrichtungen in den ersten fünf Jahren nach Inbetriebnahme aufgewendet werden müssen, soweit sie nicht vom Inhaber verursacht worden sind. 3 Die Risikogarantie beträgt mindestens 20, höchstens jedoch 60 Prozent der Kosten nach Absatz 2. 4 Für das Verfahren gelten die Artikel 61c und 61d sinngemäss.";"";NA;NA;"";NA;NA;"";NA;NA;""
"78";"Art. 58";"  Art. 581Anrechenbare Kosten";"1 Anrechenbar sind nur Kosten, die tatsächlich entstanden sind und unmittelbar für die zweckmässige Erfüllung der beitragsberechtigten Aufgabe erforderlich sind. Dazu gehören auch die Kosten für Pilotanlagen und, bei Revitalisierungen von Gewässern, die Kosten des erforderlichen Landerwerbs. 2 Nicht anrechenbar sind insbesondere Gebühren und Steuern. 1 Fassung gemäss Ziff. I der V vom 4. Mai 2011, in Kraft seit 1. Juni 2011 (AS 2011 1955).";"";NA;NA;"";NA;NA;"";NA;NA;""
"79";"Art. 59";"  Art. 59 Gesuch";"1 Der Kanton reicht das Gesuch um globale Abgeltungen beim zuständigen Bundesamt (Art. 60 Abs. 1) ein. 2 Das Gesuch muss Angaben enthalten über: a.die zu erreichenden Programmziele sowie bei Abgeltungen für Massnahmen der Landwirtschaft Angaben über die im gesamten Kantonsgebiet zu erreichenden Ziele;b.die zur Zielerreichung voraussichtlich notwendigen Massnahmen und deren Durchführung;c.die Wirksamkeit der Massnahmen.";"";NA;NA;"";NA;NA;"";NA;NA;""
"80";"Art. 60";"  Art. 60 Programmvereinbarung";"1 Für den Abschluss der Programmvereinbarung ist zuständig: a.1das BAFU für Abgeltungen an Abwasseranlagen sowie an die Planung und Durchführung von Massnahmen zur Revitalisierung von Gewässern;b.das BLW für Abgeltungen an Massnahmen der Landwirtschaft. 2 Die Programmvereinbarung wird gebietsweise abgeschlossen. Gegenstand der Programmvereinbarung sind insbesondere: a.die gemeinsam zu erreichenden strategischen Programmziele;b.die Leistung des Kantons;c.die Beitragsleistung des Bundes;d.das Controlling. 3 Die Dauer der Programmvereinbarung beträgt für Abgeltungen an: a.Massnahmen der Landwirtschaft: in der Regel 6 Jahre;b.die übrigen Massnahmen: 4 Jahre.2 4 Das zuständige Bundesamt erlässt Richtlinien über das Vorgehen bei Programmvereinbarungen sowie über die Angaben und Unterlagen zu den Gegenständen der Programmvereinbarung. 1 Fassung gemäss Ziff. I der V vom 4. Mai 2011, in Kraft seit 1. Juni 2011 (AS 2011 1955).2 Fassung gemäss Ziff. I der V vom 4. Mai 2011, in Kraft seit 1. Juni 2011 (AS 2011 1955).";"";NA;NA;"";NA;NA;"";NA;NA;""
"81";"Art. 61";"  Art. 61 Auszahlung";"Globale Abgeltungen werden in Tranchen ausbezahlt.";"";NA;NA;"";NA;NA;"";NA;NA;""
"82";"Art. 61";"  Art. 61a Berichterstattung und Kontrolle";"1 Der Kanton erstattet dem zuständigen Bundesamt jährlich Bericht über die Verwendung der globalen Abgeltungen. 2 Das zuständige Bundesamt kontrolliert stichprobenweise: a.die Ausführung einzelner Massnahmen gemäss den Programmzielen;b.die Verwendung der ausbezahlten Beiträge.";"";NA;NA;"";NA;NA;"";NA;NA;""
"83";"Art. 61";"  Art. 61b Mangelhafte Erfüllung und Zweckentfremdung";"1 Das zuständige Bundesamt hält die Tranchenzahlungen während der Programmdauer ganz oder teilweise zurück, wenn der Kanton: a.seiner Berichterstattungspflicht (Art. 61a Abs. 1) nicht nachkommt;b.eine erhebliche Störung seiner Leistung schuldhaft verursacht. 2 Stellt sich nach der Programmdauer heraus, dass die Leistung mangelhaft ist, so verlangt das zuständige Bundesamt vom Kanton Nachbesserung; es setzt ihm dafür eine angemessene Frist. 3 Werden Anlagen oder Einrichtungen, an die Abgeltungen geleistet wurden, ihrem Zweck entfremdet, so kann das zuständige Bundesamt vom Kanton verlangen, dass er innerhalb einer angemessenen Frist die Unterlassung oder Rückgängigmachung der Zweckentfremdung erwirkt. 4 Werden die Mängel nicht behoben oder wird die Zweckentfremdung nicht unterlassen oder nicht rückgängig gemacht, so richtet sich die Rückforderung nach den Artikeln 28 und 29 des Subventionsgesetzes vom 5. Oktober 19901 (SuG). 1 SR 616.1";"";NA;NA;"";NA;NA;"";NA;NA;""
"84";"Art. 61";"  Art. 61c Gesuch";"1 Das Gesuch um Finanzhilfen oder Abgeltungen im Einzelfall wird beim BAFU eingereicht. 2 Es erlässt Richtlinien über die Angaben und Unterlagen zum Gesuch.";"";NA;NA;"";NA;NA;"";NA;NA;""
"85";"Art. 61";"  Art. 61d Gewährung und Auszahlung der Beiträge";"1 Das BAFU legt die Beiträge mittels Verfügung fest oder schliesst dazu mit dem Beitragsempfänger einen Vertrag ab. 2 Es richtet die Beiträge nach Fortschritt des Projektes aus.";"";NA;NA;"";NA;NA;"";NA;NA;""
"86";"Art. 61";"  Art. 61e Mangelhafte Erfüllung und Zweckentfremdung";"1 Erfüllt der Empfänger einer zugesicherten Abgeltung oder Finanzhilfe die Massnahme trotz Mahnung nicht oder mangelhaft, so wird die Abgeltung oder Finanzhilfe nicht ausbezahlt oder gekürzt. 2 Sind Abgeltungen oder Finanzhilfen ausbezahlt worden und erfüllt der Empfänger trotz Mahnung die Massnahme nicht oder mangelhaft, so richtet sich die Rückforderung nach Artikel 28 SuG1. 3 Werden Anlagen oder Einrichtungen, an die Abgeltungen oder Finanzhilfen geleistet wurden, ihrem Zweck entfremdet, so kann das BAFU vom Kanton verlangen, dass er innerhalb einer angemessenen Frist die Unterlassung oder Rückgängigmachung der Zweckentfremdung erwirkt. 4 Wird die Zweckentfremdung nicht unterlassen oder nicht rückgängig gemacht, so richtet sich die Rückforderung nach Artikel 29 SuG. 1 SR 616.1";"";NA;NA;"";NA;NA;"";NA;NA;""
"87";"Art. 61";"  Art. 61f Berichterstattung und Kontrolle";"Für die Berichterstattung und die Kontrolle bei Abgeltungen und Finanzhilfen im Einzelfall gilt Artikel 61a sinngemäss.";"";NA;NA;"";NA;NA;"";NA;NA;""
"88";"Art. 62";"  Art. 62";"Diese Verordnung tritt am 1. Januar 1999 in Kraft.";"";NA;NA;"";NA;NA;"";NA;NA;""
