"";"article_number";"article_title";"article_text";"Obs.";"Issue.1";"Domain.1";"Project.1";"Issue.2";"Domain.2";"Project.2";"Issue.3";"Domain.3";"Project.3"
"47";"Art. 41";"  Art. 41d Planung von Revitalisierungen";"1 Die Kantone erarbeiten die Grundlagen, die für die Planung der Revitalisierungen der Gewässer notwendig sind. Die Grundlagen enthalten insbesondere Angaben über: a.den ökomorphologischen Zustand der Gewässer;b.die Anlagen im Gewässerraum;c.das ökologische Potenzial und die landschaftliche Bedeutung der Gewässer. 2 Sie legen in einer Planung für einen Zeitraum von 20 Jahren die zu revitalisierenden Gewässerabschnitte, die Art der Revitalisierungsmassnahmen und die Fristen fest, innert welcher die Massnahmen umgesetzt werden, und stimmen die Planung soweit erforderlich mit den Nachbarkantonen ab. Revitalisierungen sind vorrangig vorzusehen, wenn deren Nutzen: a.für die Natur und die Landschaft gross ist;b.im Verhältnis zum voraussichtlichen Aufwand gross ist;c.durch das Zusammenwirken mit anderen Massnahmen zum Schutz der natürlichen Lebensräume oder zum Schutz vor Hochwasser vergrössert wird. 3 Sie verabschieden die Planung nach Absatz 2 für Fliessgewässer bis zum 31. Dezember 2014 und für stehende Gewässer bis zum 31. Dezember 2022. Sie unterbreiten die Planungen dem BAFU jeweils ein Jahr vor deren Verabschiedung zur Stellungnahme.1 4 Sie erneuern die Planung nach Absatz 2 alle 12 Jahre für einen Zeitraum von 20 Jahren und unterbreiten diese dem BAFU jeweils ein Jahr vor deren Verabschiedung zur Stellungnahme. 1 Fassung gemäss Ziff. I 4 der V vom 28. Jan. 2015 über Anpassungen des Verordnungsrechts im Umweltbereich, insbesondere hinsichtlich der Programmvereinbarungen für die Programmperiode 2016-2019, in Kraft seit 1. Jan. 2016 (AS 2015 427).";"";NA;NA;"Schaffung neuer Lebensraeume, Renaturierung oder Revitalisierung";NA;NA;"";NA;NA;""
"48";"Art. 41";"  Art. 41e Wesentliche Beeinträchtigung durch Schwall und Sunk";"Eine wesentliche Beeinträchtigung der einheimischen Tiere und Pflanzen sowie von deren Lebensräumen durch Schwall und Sunk liegt vor, wenn: a.die Abflussmenge bei Schwall mindestens 1,5-mal grösser ist als bei Sunk; undb.die standortgerechte Menge, Zusammensetzung und Vielfalt der pflanzlichen und tierischen Lebensgemeinschaften nachteilig verändert werden, insbesondere weil regelmässig und auf unnatürliche Weise Fische stranden, Fischlaichplätze zerstört werden, Wassertiere abgeschwemmt werden, Trübungen entstehen oder die Wassertemperatur in unzulässiger Weise verändert wird.";"";NA;NA;"Regulierung von Gewaesserniveaus und Steuerung von Schwall und Sunk";NA;NA;"";NA;NA;""
"49";"Art. 41";"  Art. 41f Planung der Massnahmen zur Sanierung bei Schwall und Sunk";"1 Die Kantone reichen dem BAFU eine Planung der Massnahmen zur Sanierung von Wasserkraftwerken, die Schwall und Sunk verursachen, nach den in Anhang 4a Ziffer 2 beschriebenen Schritten ein. 2 Die Inhaber von Wasserkraftwerken müssen der für die Planung zuständigen Behörde Zutritt gewähren und die erforderlichen Auskünfte erteilen, insbesondere über: a.die Koordinaten und die Bezeichnung der einzelnen Anlagenteile;b.die Abflussmengen des betroffenen Gewässers mit Messwerten im Abstand von höchstens 15 Minuten (Ganglinie) über den Zeitraum der letzten fünf Jahre; liegen solche Messwerte nicht vor, kann die Ganglinie aus Angaben zur Produktion des Wasserkraftwerks und dem Abfluss im Gewässer berechnet werden;c.die durchgeführten und die geplanten Massnahmen zur Verminderung der Auswirkungen von Schwall und Sunk;d.die vorhandenen Untersuchungsergebnisse zu den Auswirkungen von Schwall und Sunk;e.die vorgesehenen baulichen und betrieblichen Veränderungen der Anlage.";"";NA;NA;"Regulierung von Gewaesserniveaus und Steuerung von Schwall und Sunk";NA;NA;"Schaffung neuer Lebensraeume, Renaturierung oder Revitalisierung";NA;NA;""
"50";"Art. 41";"  Art. 41g Massnahmen zur Sanierung bei Schwall und Sunk";"1 Die kantonale Behörde ordnet gestützt auf die Planung der Massnahmen die Sanierungen bei Schwall und Sunk an und verpflichtet die Inhaber von Wasserkraftwerken, zur Umsetzung der Planung verschiedene Varianten von Sanierungsmassnahmen zu prüfen. 2 Bevor sie über das Sanierungsprojekt entscheidet, hört sie das BAFU an. Das BAFU prüft im Hinblick auf das Gesuch nach Artikel 17d Absatz 1 der Energieverordnung vom 7. Dezember 19981 (EnV), ob die Anforderungen nach Anhang 1.7 Ziffer 2 EnV erfüllt sind. 3 Die Inhaber von Wasserkraftwerken prüfen nach Anordnung der Behörde die Wirksamkeit der getroffenen Massnahmen. 1 SR 730.01";"";NA;NA;"Regulierung von Gewaesserniveaus und Steuerung von Schwall und Sunk";NA;NA;"Schaffung neuer Lebensraeume, Renaturierung oder Revitalisierung";NA;NA;""
"51";"Art. 42";"  Art. 42 …1";"1 Bevor eine Behörde eine Spülung oder Entleerung eines Stauraumes bewilligt, stellt sie sicher, dass die Sedimente anders als durch Ausschwemmung entfernt werden, wenn dies umweltverträglich und wirtschaftlich tragbar ist. 2 Bei der Ausschwemmung von Sedimenten stellt die Behörde sicher, dass Lebensgemeinschaften von Pflanzen, Tieren und Mikroorganismen möglichst wenig beeinträchtigt werden, insbesondere indem sie festlegt: a.Zeitpunkt und Art der Spülung oder Entleerung;b.die maximale Schwebstoffkonzentration, die im Gewässer während der Spülung oder Entleerung eingehalten werden muss;c.in welchem Umfang nachgespült werden muss, damit während der Spülung oder Entleerung im Fliessgewässer abgelagertes Feinmaterial entfernt wird. 3 Die Absätze 1 und 2 gelten nicht für sofortige Absenkungen aufgrund ausser-ordentlicher Ereignisse (Art. 40 Abs. 3 GSchG). 1 Aufgehoben durch Ziff. I der V vom 4. Mai 2011, mit Wirkung seit 1. Juni 2011 (AS 2011 1955).";"";NA;NA;"Regulierung von Gewaesserniveaus und Steuerung von Schwall und Sunk";NA;NA;"";NA;NA;""
"52";"Art. 42";"  Art. 42a1Wesentliche Beeinträchtigung durch veränderten Geschiebehaushalt";"Eine wesentliche Beeinträchtigung der einheimischen Tiere und Pflanzen sowie von deren Lebensräumen durch einen veränderten Geschiebehaushalt liegt vor, wenn Anlagen wie Wasserkraftwerke, Kiesentnahmen, Geschiebesammler oder Gewässerverbauungen die morphologischen Strukturen oder die morphologische Dynamik des Gewässers nachteilig verändern. 1 Eingefügt durch Ziff. I der V vom 4. Mai 2011, in Kraft seit 1. Juni 2011 (AS 2011 1955).";"";NA;NA;"";NA;NA;"";NA;NA;""
"53";"Art. 42";"  Art. 42b1Planung der Massnahmen zur Sanierung des Geschiebehaushalts";"1 Die Kantone reichen dem BAFU eine Planung der Massnahmen zur Sanierung des Geschiebehaushalts nach den in Anhang 4a Ziffer 3 beschriebenen Schritten ein. 2 Die Inhaber von Anlagen müssen der für die Planung zuständigen Behörde Zutritt gewähren und die erforderlichen Auskünfte erteilen, insbesondere über: a.die Koordinaten und die Bezeichnung der Anlagen und bei Wasserkraftwerken der einzelnen Anlagenteile;b.den Umgang mit Geschiebe;c.die durchgeführten und die geplanten Massnahmen zur Verbesserung des Geschiebehaushalts;d.die vorhandenen Untersuchungsergebnisse zum Geschiebehaushalt;e.die vorgesehenen baulichen und betrieblichen Veränderungen der Anlage. 1 Eingefügt durch Ziff. I der V vom 4. Mai 2011, in Kraft seit 1. Juni 2011 (AS 2011 1955).";"";NA;NA;"";NA;NA;"";NA;NA;""
"54";"Art. 42";"  Art. 42c1Massnahmen zur Sanierung des Geschiebehaushalts";"1 Die Kantone erstellen für Anlagen, für die gemäss der Planung Massnahmen zur Sanierung des Geschiebehaushalts zu treffen sind, eine Studie über die Art und den Umfang der notwendigen Massnahmen. 2 Die kantonale Behörde ordnet gestützt auf die Studie nach Absatz 1 die Sanierungen an. Bei Wasserkraftwerken muss das Geschiebe soweit möglich durch die Anlage durchgeleitet werden. 3 Bevor sie bei Wasserkraftwerken über das Sanierungsprojekt entscheidet, hört sie das BAFU an. Das BAFU prüft im Hinblick auf das Gesuch nach Artikel 17d Absatz 1 EnV2, ob die Anforderungen nach Anhang 1.7 Ziffer 2 EnV erfüllt sind. 4 Die Inhaber von Wasserkraftwerken prüfen nach Anordnung der kantonalen Behörde die Wirksamkeit der getroffenen Massnahmen. 1 Eingefügt durch Ziff. I der V vom 4. Mai 2011, in Kraft seit 1. Juni 2011 (AS 2011 1955).2 SR 730.01";"";NA;NA;"";NA;NA;"";NA;NA;""
"55";"Art. 43";"  Art. 43 Ausbeutung von Kies, Sand und anderem Material in Fliessgewässern";"1 Damit bei der Ausbeutung von Kies, Sand und anderem Material der Geschiebehaushalt eines Fliessgewässers nicht nachteilig beeinflusst wird (Art. 44 Abs. 2 Bst. c GSchG), muss die Behörde insbesondere sicherstellen, dass: a.dem Fliessgewässer langfristig nicht mehr Geschiebe entnommen als natürlicherweise zugeführt wird;b.die Ausbeutung langfristig nicht zu einer Absenkung der Sohle ausserhalb des Abbauperimeters führt;c.die Ausbeutung die Erhaltung und Wiederherstellung von inventarisierten Auen nicht verunmöglicht;d.die Ausbeutung nicht zu einer erheblichen Veränderung der Korngrössenverteilung des Sohlenmaterials ausserhalb des Abbauperimeters führt. 2 Ausbeutungen nach Absatz 1 dürfen nicht zu Trübungen führen, die Fischgewässer beeinträchtigen können.";"";NA;NA;"";NA;NA;"";NA;NA;""
"56";"Art. 44";"  Art. 44 …1";"1 Drainagewasser aus Untertagebauten muss so gefasst und abgeleitet werden, dass es bei deren Betrieb, insbesondere durch ausserordentliche Ereignisse, nicht verunreinigt werden kann; dies gilt nicht für kleine Mengen von Drainagewasser, wenn durch Rückhaltemassnahmen verhindert wird, dass ein Gewässer verunreinigt werden kann. 2 Für die Einleitung von Drainagewasser aus Untertagebauten in Fliessgewässer gilt: a.Das Einlaufbauwerk muss eine rasche Durchmischung gewährleisten.b.Die Aufwärmung des Gewässers darf gegenüber dem möglichst unbeeinflussten Zustand höchstens 3 °C, in Gewässerabschnitten der Forellenregion höchstens 1,5 °C, betragen.c.Die Einleitung darf nicht dazu führen, dass die Wassertemperatur 25 °C überschreitet. 3 Die Behörde legt entsprechend den örtlichen Verhältnissen fest: a.Anforderungen an die Einleitung in Seen und an die Versickerung;b.nötigenfalls weitere Anforderungen an die Einleitung in Fliessgewässer. 1 Aufgehoben durch Ziff. I der V vom 4. Mai 2011, mit Wirkung seit 1. Juni 2011 (AS 2011 1955).";"";NA;NA;"";NA;NA;"";NA;NA;""
"57";"Art. 45";"  Art. 451Vollzug durch Kantone und Bund";"1 Die Kantone vollziehen diese Verordnung, soweit diese den Vollzug nicht dem Bund überträgt. 2 Wenden Bundesbehörden andere Bundesgesetze oder völkerrechtliche Vereinbarungen oder Beschlüsse an, die Gegenstände dieser Verordnung betreffen, so vollziehen sie dabei auch diese Verordnung. Für die Mitwirkung des BAFU und der Kantone gilt Artikel 48 Absatz 1 GSchG; gesetzliche Geheimhaltungspflichten bleiben vorbehalten. 3 Die Bundesbehörden berücksichtigen auf Antrag der Kantone deren Vorschriften und Massnahmen, soweit dadurch die Erfüllung der Aufgaben des Bundes nicht verunmöglicht oder unverhältnismässig erschwert wird. 4 Erlassen die Bundesbehörden Verwaltungsverordnungen wie Richtlinien oder Weisungen, die den Gewässerschutz betreffen, so hören sie das BAFU an. 5 Das Eidgenössische Departement für Umwelt, Verkehr, Energie und Kommunikation (Departement) kann, soweit erforderlich, die Listen der Parameter und der numerischen Anforderungen an die Wasserqualität nach Anhang 2 Ziffer 11 Absatz 3, Ziffer 12 Absatz 5 und Ziffer 22 Absatz 2 ändern.2 1 Fassung gemäss Ziff. II 12 der V vom 2. Febr. 2000 zum BG über die Koordination und Vereinfachung von Entscheidverfahren, in Kraft seit 1. März 2000 (AS 2000 703).2 Eingefügt durch Ziff. I der V vom 4. Nov. 2015, in Kraft seit 1. Jan. 2016 (AS 2015 4791).";"";NA;NA;"";NA;NA;"";NA;NA;""
"58";"Art. 46";"  Art. 46 Koordination1";"1 Die Kantone stimmen die Massnahmen nach dieser Verordnung soweit erforderlich aufeinander und mit Massnahmen aus anderen Bereichen ab. Sie sorgen ausserdem für eine Koordination der Massnahmen mit den Nachbarkantonen.2 1bis Sie berücksichtigen bei der Erstellung der Richt- und Nutzungsplanung die Planungen nach dieser Verordnung.3 2 Bei der Erstellung der Versorgungsplanung für Trinkwasser erfassen sie die genutzten und die zur Nutzung vorgesehenen Grundwasservorkommen und sorgen dafür, dass Wasserentnahmen so aufeinander abgestimmt werden, dass keine übermässigen Entnahmen erfolgen und die Grundwasservorkommen haushälterisch genutzt werden. 3 Bei der Erteilung von Bewilligungen für Einleitungen und Versickerungen nach den Artikeln 6-8 berücksichtigt die Behörde auch die Anforderungen des Umweltschutzgesetzes vom 7. Oktober 19834 an den Schutz der Bevölkerung vor Geruchsimmissionen sowie die Anforderungen des Arbeitsgesetzes vom 13. März 19645 und des Unfallversicherungsgesetzes vom 20. März 19816 an den Schutz der Gesundheit des Personals von Abwasseranlagen. 1 Fassung gemäss Ziff. I der V vom 4. Mai 2011, in Kraft seit 1. Juni 2011 (AS 2011 1955).2 Fassung gemäss Ziff. I der V vom 4. Mai 2011, in Kraft seit 1. Juni 2011 (AS 2011 1955).3 Eingefügt durch Ziff. I der V vom 4. Mai 2011, in Kraft seit 1. Juni 2011 (AS 2011 1955).4 SR 814.015 SR 822.116 SR 832.20";"";NA;NA;"Raumplanungsinstrumente";NA;NA;"";NA;NA;""
"59";"Art. 47";"  Art. 47 Vorgehen bei verunreinigten Gewässern";"1 Stellt die Behörde fest, dass ein Gewässer die Anforderungen an die Wasserqualität nach Anhang 2 nicht erfüllt oder dass die besondere Nutzung des Gewässers nicht gewährleistet ist, so: a.ermittelt und bewertet sie die Art und das Ausmass der Verunreinigung;b.ermittelt sie die Ursachen der Verunreinigung;c.beurteilt sie die Wirksamkeit der möglichen Massnahmen;d.sorgt sie dafür, dass gestützt auf die entsprechenden Vorschriften die erforderlichen Massnahmen getroffen werden. 2 Sind mehrere Quellen an der Verunreinigung beteiligt, so sind die bei den Verursachern erforderlichen Massnahmen aufeinander abzustimmen.";"";NA;NA;"";NA;NA;"";NA;NA;""
"60";"Art. 48";"  Art. 48 Untersuchungen und Ermittlungen";"1 Untersuchungen und Ermittlungen richten sich nach den anerkannten Regeln der Technik; als solche gelten insbesondere die entsprechenden Normen des CEN (Europäisches Komitee für Normung)1 oder andere Normen, die gleichwertige Ergebnisse liefern. 2 Soweit diese Verordnung keine Vorschriften über die Art und Häufigkeit der Probenahmen und die Ermittlung der Einhaltung der Anforderungen enthält, legt dies die Behörde im Einzelfall fest. 1 Bezugsquelle: Schweizerische Normen-Vereinigung (SNV), Bürglistrasse 29, 8400 Winterthur; www.snv.ch";"";NA;NA;"";NA;NA;"";NA;NA;""
"61";"Art. 49";"  Art. 49 Information";"1 Das BAFU informiert über den Zustand der Gewässer und den Gewässerschutz, soweit dies im gesamtschweizerischen Interesse liegt; es veröffentlicht insbesondere Berichte über den Stand des Gewässerschutzes in der Schweiz. Die Kantone stellen ihm die notwendigen Angaben zur Verfügung. 2 Die Kantone informieren über den Zustand der Gewässer und den Gewässerschutz in ihrem Kanton; dabei informieren sie auch über die getroffenen Massnahmen und deren Wirksamkeit sowie über Badeplätze, bei denen die Voraussetzungen für das Baden (Anhang 2 Ziff. 11 Abs. 1 Bst. e) nicht erfüllt sind.1 1 Fassung gemäss Ziff. I der V vom 4. Mai 2011, in Kraft seit 1. Juni 2011 (AS 2011 1955).";"";NA;NA;"";NA;NA;"";NA;NA;""
"62";"Art. 49";"  Art. 49a1Geoinformation";"Das BAFU gibt die minimalen Geodatenmodelle und Darstellungsmodelle für Geobasisdaten nach dieser Verordnung vor, für die es im Anhang 1 der Geoinformationsverordnung vom 21. Mai 20082 als Fachstelle des Bundes bezeichnet ist. 1 Eingefügt durch Anhang 2 Ziff. 7 der V vom 21. Mai 2008 über Geoinformation, in Kraft seit 1. Juli 2008 (AS 2008 2809).2 SR 510.620";"";NA;NA;"";NA;NA;"";NA;NA;""
"63";"Art. 50";"  Art. 501";"1 Aufgehoben durch Ziff. III 2 der V vom 12. Aug. 2015, mit Wirkung seit 1. Okt. 2015 (AS 2015 2903).";"";NA;NA;"";NA;NA;"";NA;NA;""
"64";"Art. 51";"  Art. 51 Internationale Beschlüsse, Empfehlungen und Kommissionen1";"1 Das Departement ist ermächtigt, Beschlüsse und Empfehlungen, die gestützt auf die folgenden völkerrechtlichen Vereinbarungen erfolgen, mit Zustimmung des Eidgenössischen Departements für Wirtschaft, Bildung und Forschung zu genehmigen:2 a.Übereinkommen vom 22. September 19923 über den Schutz der Meeresumwelt des Nordost-Atlantiks (OSPAR-Übereinkommen);b.Vereinbarung vom 29. April 19634 über die Internationale Kommission zum Schutze des Rheins gegen Verunreinigung;c.Übereinkommen vom 3. Dezember 19765 zum Schutz des Rheins gegen chemische Verunreinigung. 2 Das BAFU stellt die genehmigten Beschlüsse und Empfehlungen Dritten auf Verlangen zu. 3 Das Departement wählt die Mitglieder der schweizerischen Delegationen in den zwischenstaatlichen Kommissionen für den Gewässerschutz.6 1 Fassung gemäss Ziff. II 12 der V vom 2. Febr. 2000 zum BG über die Koordination und Vereinfachung von Entscheidverfahren, in Kraft seit 1. März 2000 (AS 2000 703).2 Fassung gemäss Ziff. I der V vom 4. Nov. 2015, in Kraft seit 1. Jan. 2016 (AS 2015 4791).3 SR 0.814.2934 [AS 1965 388, 1979 93. AS 2003 1934 Art. 19 Ziff. 2, 3]. Heute: Übereink. vom 12. April 1999 zum Schutz des Rheins (SR 0.814.284).5 [AS 1979 97, 1983 323, 1989 161. AS 2003 1934 Art. 19 Ziff. 2]6 Eingefügt durch Ziff. II 12 der V vom 2. Febr. 2000 zum BG über die Koordination und Vereinfachung von Entscheidverfahren, in Kraft seit 1. März 2000 (AS 2000 703).";"";NA;NA;"";NA;NA;"";NA;NA;""
"65";"Art. 51";"  Art. 51a Abgabesatz";"Die Höhe der Abgabe nach Artikel 60b GSchG beträgt jährlich 9 Franken pro Einwohner. Massgebend ist die Anzahl der Einwohner, die am 1. Januar des Kalenderjahres, für welches die Abgabe erhoben wird, an die Abwasserreinigungsanlage angeschlossen sind.";"";NA;NA;"";NA;NA;"";NA;NA;""
"66";"Art. 51";"  Art. 51b Angaben der Kantone";"Die Kantone müssen dem BAFU: a.jährlich bis zum 31. März für jede zentrale Abwasserreinigungsanlage auf ihrem Gebiet die Anzahl der am 1. Januar des laufenden Kalenderjahres an die Anlagen angeschlossenen Einwohner melden;b.die bei ihnen nach Artikel 60b Absatz 2 GSchG bis zum 30. September eines Kalenderjahres eingegangenen Schlussabrechnungen mit dem Gesuch um Abgeltungen bis am 31. Oktober desselben Kalenderjahres einreichen.";"";NA;NA;"";NA;NA;"";NA;NA;""
"67";"Art. 51";"  Art. 51c Erhebung der Abgabe";"1 Das BAFU stellt den Abgabepflichtigen die Abgabe für das laufende Kalenderjahr jährlich bis zum 1. Juni in Rechnung. Es erlässt bei Streitigkeiten über die Rechnung eine Gebührenverfügung. 2 Auf Gesuch des Kantons kann das BAFU die Abgabe dem Kanton in Rechnung stellen, sofern dieser darlegt, dass er bei den Abwasserreinigungsanlagen auf seinem Gebiet die Abgabe nach den gleichen Vorgaben wie das BAFU erhebt. Das Gesuch ist bis zum 31. März beim BAFU einzureichen. 3 Die Zahlungsfrist beträgt 60 Tage ab Fälligkeit. Die Abgabe wird fällig mit Eintreffen der Rechnung oder, bei bestrittener Rechnung, mit Rechtskraft der Gebührenverfügung nach Absatz 1. Bei verspäteter Zahlung ist ein Verzugszins von 5 Prozent geschuldet.1 1 Fassung gemäss Ziff. I der V vom 22. März 2017, in Kraft seit 1. Mai 2017 (AS 2017 2585).";"";NA;NA;"";NA;NA;"";NA;NA;""
"68";"Art. 51";"  Art. 51d Verjährung";"1 Die Abgabeforderung verjährt zehn Jahre nach Ablauf des Kalenderjahres, in dem sie entstanden ist. 2 Die Verjährung wird unterbrochen und beginnt neu zu laufen: a.wenn der Abgabepflichtige die Abgabeforderung anerkennt;b.durch jede Amtshandlung, mit der die Abgabeforderung beim Abgabepflichtigen geltend gemacht wird. 3 Die Abgabeforderung verjährt in jedem Fall 15 Jahre nach Ablauf des Kalenderjahres, in dem sie entstanden ist.";"";NA;NA;"";NA;NA;"";NA;NA;""
"69";"Art. 52";"  Art. 52 Stickstoffelimination bei Abwasseranlagen1";"1 Die Höhe der globalen Abgeltungen an Anlagen und Einrichtungen zur Stickstoffelimination (Art. 61 Abs. 1 GSchG) richtet sich nach der jährlich reduzierten Anzahl Tonnen Stickstoff. 2 Soweit zur Erfüllung völkerrechtlicher Vereinbarungen oder von Beschlüssen internationaler Organisationen notwendig, können zudem Umfang und Komplexität der Massnahmen berücksichtigt werden. 3 Die Höhe der globalen Abgeltungen wird zwischen dem BAFU und dem betroffenen Kanton ausgehandelt. 1 Fassung gemäss Ziff. I der V vom 4. Nov. 2015, in Kraft seit 1. Jan. 2016 (AS 2015 4791).";"";NA;NA;"";NA;NA;"";NA;NA;""
"70";"Art. 52";"  Art. 52a1Elimination von organischen Spurenstoffen bei Abwasseranlagen";"1 Abgeltungen an Massnahmen zur Elimination von organischen Spurenstoffen nach Artikel 61a Absatz 1 GSchG werden den Kantonen einzeln gewährt. 2 Wird die abgeltungsberechtigte Massnahme nicht innert fünf Jahren nach der Zusicherung der Abgeltung umgesetzt, so verfällt die Zusicherung. 3 Werden anstelle von Anlagen und Einrichtungen zur Elimination von organischen Spurenstoffen Kanalisationen erstellt, so sind Kosten höchstens in der Höhe anrechenbar, in der sie bei Massnahmen auf der Abwasserreinigungsanlage selber entstanden wären. 4 Bevor die Behörde über die Massnahme entscheidet, hört sie das BAFU an. 1 Eingefügt durch Ziff. I der V vom 4. Nov. 2015, in Kraft seit 1. Jan. 2016 (AS 2015 4791).";"";NA;NA;"";NA;NA;"";NA;NA;""
"71";"Art. 53";"  Art. 53 Abfallanlagen";"Abgeltungen für beitragsberechtigte Abfallanlagen (Art. 62 Abs. 1 und 2 GSchG) werden bei Projekten an die Planung, die erstmalige Erstellung und die Erweiterung einzeln geleistet.";"";NA;NA;"";NA;NA;"";NA;NA;""
"72";"Art. 54";"  Art. 54 Massnahmen der Landwirtschaft";"1 Die Höhe der globalen Abgeltungen an Massnahmen der Landwirtschaft (Art. 62a GSchG) richtet sich nach den Eigenschaften und der Anzahl Kilogramm der Stoffe, deren Abschwemmung und Auswaschung jährlich verhindert wird. 2 Für Massnahmen, welche Änderungen der Betriebsstrukturen zur Folge haben, richtet sich die Höhe ausserdem nach den anrechenbaren Kosten. 3 Die Höhe der globalen Abgeltungen wird zwischen dem Bundesamt für Landwirtschaft (BLW) und dem betroffenen Kanton ausgehandelt.";"?";NA;NA;"";NA;NA;"";NA;NA;""
"73";"Art. 54";"  Art. 54a1Planung von Massnahmen zur Revitalisierung";"1 Die Höhe der globalen Abgeltungen an die Planung von Massnahmen zur Revitalisierung von Gewässern (Art. 62b Abs. 1 GSchG) richtet sich nach der Länge der Gewässer, die in die Planung einbezogen werden. 2 Die Höhe der globalen Abgeltungen wird zwischen dem BAFU und dem betroffenen Kanton ausgehandelt. 1 Eingefügt durch Ziff. I der V vom 4. Mai 2011, in Kraft seit 1. Juni 2011 (AS 2011 1955).";"";NA;NA;"";NA;NA;"";NA;NA;""
"74";"Art. 54";"  Art. 54b1Durchführung von Massnahmen zur Revitalisierung";"1 Die Höhe der globalen Abgeltungen an die Massnahmen zur Revitalisierung von Gewässern (Art. 62b Abs. 1 GSchG) richtet sich nach: a.der Länge des Gewässerabschnitts, der revitalisiert oder durch die Beseitigung von Hindernissen zusätzlich durchgängig wird;b.der Breite der Gerinnesohle des Gewässers;c.der Breite des Gewässerraums des Gewässers, das revitalisiert wird;d.dem Nutzen der Revitalisierung für die Natur und die Landschaft im Verhältnis zum voraussichtlichen Aufwand;e.dem Nutzen der Revitalisierung für die Erholung;f.der Qualität der Massnahmen. 2 Die Höhe der globalen Abgeltungen wird zwischen dem BAFU und dem betroffenen Kanton ausgehandelt. 3 Abgeltungen können einzeln gewährt werden, wenn die Massnahmen: a.mehr als fünf Millionen Franken kosten;b.einen kantonsübergreifenden Bezug aufweisen oder Landesgrenzgewässer betreffen;c.Schutzgebiete oder Objekte nationaler Inventare berühren;d.wegen der möglichen Alternativen oder aus anderen Gründen in besonderem Mass eine komplexe oder spezielle fachliche Beurteilung erfordern; odere.unvorhersehbar waren. 4 Der Beitrag an die anrechenbaren Kosten der Massnahmen nach Absatz 3 beträgt zwischen 35 und 80 Prozent und richtet sich nach den in Absatz 1 genannten Kriterien. 5 Abgeltungen an Revitalisierungen werden nur gewährt, wenn der betroffene Kanton eine den Anforderungen von Artikel 41d entsprechende Planung von Revitalisierungen erstellt hat. 6 Keine Abgeltungen nach Artikel 62b Absatz 1 GSchG werden gewährt für Massnahmen, die nach Artikel 4 des Bundesgesetzes vom 21. Juni 19912 über den Wasserbau erforderlich sind. 1 Eingefügt durch Ziff. I der V vom 4. Mai 2011, in Kraft seit 1. Juni 2011 (AS 2011 1955). Siehe auch die UeB dieser Änd. am Schluss des Textes.2 SR 721.100";"";NA;NA;"";NA;NA;"";NA;NA;""
"75";"Art. 55";"  Art. 55 Grundlagenbeschaffung";"1 Abgeltungen für die Ermittlung der Ursache der ungenügenden Wasserqualität eines wichtigen Gewässers im Hinblick auf die Sanierungsmassnahmen (Art. 64 Abs. 1 GSchG) werden einzeln geleistet, soweit die Projekte den Zustand des Gewässers und dessen Zuflüsse betreffen. 2 Die Abgeltungen für die Grundlagenbeschaffung betragen 30 Prozent und diejenigen für die Inventare über Wasserversorgungsanlagen und Grundwasservorkommen (Art. 64 Abs. 3 GSchG) 40 Prozent der anrechenbaren Kosten.";"";NA;NA;"";NA;NA;"";NA;NA;""
